Skip,Category,Id,Question,Type,Info,0,1,2,3,4,5,6,7,8,9,10,11,12,13,14,15,16,17,18,19,20,21,22,23,24,25,26,27,28,29,30,31,32,33,34,35,36,37,38,39,40,41,42,43,44,45,46,47,48,49
"99.1",Smoking,102,Would you like help to give up smoking?,SC,null,Yes,No
null,Alchohol,103,Do you drink alcohol regularly?,SC,null,Yes,No
"103.1",Alchohol,104,What type of alcohol do you drink?,MC,null,Beer / lager,Cider,Alcopops,Wine,Spirits (e.g. vodka, whisky, gin),TEXT_OTHER
"103.1",Alchohol,105,How many times do you drink alcohol in a typical week?,SC,null,Less than once,Once or twice,3-4 times,5-6 times,Every day
"103.1",Alchohol,106,How much do you usually drink in one sitting?,TEXT,null
"103.1",Alchohol,107,Why do you drink alcohol?,MC,null,I enjoy it,It stops me feeling stressed,All my friends drink,I drink it with my family,It tastes nice,To socialise with friends,I can't do without it,TEXT_OTHER
"103.1",Alchohol,108,Do you think you drink too much alcohol?,SC,null,Yes,No,I'm not sure
"103.1",Alchohol,109,Do you know how to manage your diabetes when drinking alcohol?,SC,null,Yes,No,I'm not sure
"103.1",Alchohol,110,Would you like help with your alcohol drinking?,SC,null,Yes,No,I'm not sure
null,Parties,111,You are going to a party one Friday night with your friends and you know that they will be drinking alcohol. Which statement best describes what you would do?,SC,null,"I would go to the party but I would drink any alcohol","I would go to the party and have a drink but I would monitor my blood glucose levels to make sure I was ok ","I would go to the party, drink the same as my friends and not worry about my diabetes ","I would not go to the party ",TEXT_OTHER
null,Parties,112,Which statement best describes you?,SC,null,"I do have a problem with diabetes, it's just a part of my life ","I sometimes wish I did have diabetes, but I just get on with it because I have to ","I hate having diabetes "
null,Living,113,"Now you have answered the questions about living with diabetes, how does diabetes affect your life?",SC,null,"My diabetes doesn't stop me from doing anything","I ca always do what I want, but I manage","My diabetes stops me from doing lots of things"
null,Living,114,Which of the following people do you feel support you with managing your diabetes?,MC,null,Parent(s) / carer(s) / guardian(s),Brother(s) / sister(s),Auntie(s) / uncle(s),Grandparent(s),Cousin(s),Au pair / nanny,Friends,Teachers / employers,Diabetes nurse,Diabetes consultant (doctor),Diabetes dietician,Nobody,Counsellor / psychologist,TEXT_OTHER
null,Living,115,Which of the following people do you feel understand your diabetes?,MC,null,Parent(s) / carer(s) / guardian(s),Brother(s) / sister(s),Auntie(s) / uncle(s),Grandparent(s),Cousin(s),Au pair / nanny,Friends,Teachers / employers,Diabetes nurse,Diabetes consultant (doctor),Diabetes dietician,Nobody,Counsellor / psychologist,TEXT_OTHER
null,Living,116,Rate how you feel about your life at the moment in relation to.....?,MCV,null,Very happy,Things could be better,Unhappy,School / college / work,Friends,Family,Well-being,My future
null,Living,117,"And to finish......now you have answered all the questions, how do you feel about your diabetes at the moment?",SC,null,OK,Things could be better,Unhappy
